{
  "event_id": "evt_01J9ZR0000REFUND000000001",
  "event_type": "payment.refunded",
  "schema_version": 1,
  "occurred_at": "2026-10-10T10:00:00Z",
  "data": {
    "refund_id": "HLR-RF-1",
    "payment_id": "HLR-PAY-9001",
    "amount_refunded": 200000,
    "currency": "BDT",
    "refunded_at": "2026-10-10T10:00:00Z"
  }
}
