{
  "event_id": "evt_01J9ZK0000REG00000000001",
  "event_type": "user.registered",
  "schema_version": 1,
  "occurred_at": "2026-10-08T14:58:00Z",
  "data": {
    "external_user_id": "HLR-456",
    "registered_at": "2026-10-08T14:58:00Z",
    "signals": { "ip": "103.4.5.6", "email": "k@x.com" }
  }
}
